{
	"schema": "hiviz@1",
	"name": "Title sequence \u2014 drop in with impact",
	"description": "Hero title moment. Heavy condensed sans title drops in from above the frame with a 12-tap directional motion blur trail that fades as velocity drops to zero, hits a brief brightness flash at the impact frame (progress 0.21), and settles with a faint decaying shake. All motion is shader-driven via UV offset on the captured text texture; the DOM renders the title statically at its resting position. Atmospheric deep-black backdrop with subtle off-frame warm glow (upper-left key) and fine film grain. Tests shader-driven text motion + directional motion blur, a technique not exercised by any existing preset.",
	"pack": "syntax",
	"state": {
		"transport": {
			"orientation": "horizontal",
			"durationSeconds": 6,
			"fps": 30,
			"format": "webm"
		},
		"backgroundFill": "#030308",
		"typography": {
			"fontFamily": "sans",
			"paperColor": "#000000",
			"inkColor": "#fffaf0"
		},
		"marks": {
			"defaults": {},
			"timings": []
		},
		"surface": {
			"type": "title-sequence",
			"content": {
				"kicker": "EPISODE 47",
				"title": "Escape Velocity",
				"body": ""
			},
			"enter": {
				"start": 0,
				"duration": 0.05,
				"ease": "smooth"
			},
			"exit": {
				"start": 0.9,
				"duration": 0.04,
				"ease": "smooth"
			}
		},
		"textAnimations": [
			{
				"id": "kicker-fade",
				"target": {
					"kind": "surface",
					"slot": "kicker"
				},
				"effect": "fade-through",
				"enter": {
					"start": 0.24,
					"duration": 0.060,
					"ease": "settled"
				},
				"exit": {
					"start": 0.88,
					"duration": 0.040,
					"ease": "smooth"
				}
			}
		],
		"overlays": [],
		"effects": []
	}
}
