{
	"schema": "hiviz@1",
	"name": "Chapter card — cinematic demo",
	"description": "Hero demo for the chapter-card Surface. Slow shader-side camera push with two-layer parallax (background drifts at the camera rate; atmospheric noise drifts at 1.7× for closer-layer parallax) over a deep cool slate substrate; single warm key-light implied from upper-right (off-centre, not radial halo). Centred kicker over huge serif title. 8 s duration lets the camera move breathe; designed to read as a documentary chapter break.",
	"pack": "syntax",
	"state": {
		"transport": {
			"orientation": "horizontal",
			"durationSeconds": 8,
			"fps": 30,
			"format": "webm"
		},
		"backgroundFill": "#040609",
		"typography": {
			"fontFamily": "serif",
			"paperColor": "#080612",
			"inkColor": "#f4ecdc"
		},
		"marks": {
			"defaults": {},
			"timings": []
		},
		"surface": {
			"type": "chapter-card",
			"content": {
				"kicker": "CHAPTER 03",
				"title": "The Long Drift",
				"body": ""
			},
			"enter": {
				"start": 0,
				"duration": 0.05,
				"ease": "settled"
			},
			"exit": {
				"start": 0.95,
				"duration": 0.05,
				"ease": "smooth"
			},
			"soundKit": "syntax"
		},
		"textAnimations": [
			{
				"id": "kicker-fade",
				"target": {
					"kind": "surface",
					"slot": "kicker"
				},
				"effect": "fade-through",
				"enter": {
					"start": 0.06,
					"duration": 0.05,
					"ease": "settled",
					"sound": {
						"mute": true
					}
				}
			},
			{
				"id": "title-reveal",
				"target": {
					"kind": "surface",
					"slot": "title"
				},
				"effect": "mask-reveal-up",
				"enter": {
					"start": 0.1,
					"duration": 0.05,
					"ease": "settled"
				}
			}
		],
		"overlays": [],
		"effects": [],
		"audioCues": [
			{
				"id": "bed",
				"kind": "bed",
				"assetSlug": "syntax-bed-texture",
				"start": 0,
				"duration": 1,
				"volume": 0.4
			}
		]
	}
}
