{
	"schema": "hiviz@1",
	"kind": "fixture",
	"name": "Halftone dots — effect fixture",
	"description": "Proving fixture for the halftone-dots Effect (ported to WGSL from @paper-design/shaders halftone-dots, Apache-2.0). Classic square-grid dot screen over the pullquote-on-photo surface: the substrate's tonal ramps size the ink dots (dark → big, bright → paper shows through), so the moody photo becomes a printed halftone and the bright quote knocks out to paper — the print convention. Palette mode: near-black ink on warm paper. Full-frame piece (backgroundFill); the effect's transparent-alpha contract (E4) is masked to the content silhouette by construction. Fixture — exercises the pipeline, not held to the deliverable floors.",
	"pack": "syntax",
	"state": {
		"transport": { "orientation": "horizontal", "durationSeconds": 4, "fps": 30, "format": "webm" },
		"backgroundFill": "#0a0807",
		"typography": { "fontFamily": "serif", "paperColor": "#2a2018", "inkColor": "#fdf6ec" },
		"marks": { "defaults": {}, "timings": [] },
		"surface": {
			"type": "pullquote-on-photo",
			"content": {
				"title": "Dark cells swell into ink; bright cells shrink to pinpoints — the picture lives in the size of the dots.",
				"author": "HALFTONE — CLASSIC · SQUARE GRID",
				"body": ""
			},
			"enter": { "start": 0, "duration": 0.08, "ease": "settled" },
			"exit": { "start": 0.92, "duration": 0.06, "ease": "smooth" }
		},
		"overlays": [],
		"effects": [
			{
				"type": "halftone-dots",
				"id": "screen",
				"params": {
					"dotType": "classic",
					"grid": "square",
					"size": 0.6,
					"radius": 1,
					"contrast": 0.55,
					"originalColors": false,
					"inverted": false,
					"colorFront": "#111111",
					"colorBack": "#fdf6ec"
				}
			}
		]
	}
}
