{
	"schema": "hiviz@1",
	"name": "Docu stat build (vertical)",
	"description": "Vertical re-authoring of the docu stat build — the three stat-callouts stack into a single column inside the platform-safe middle band (clear of the top 6%, bottom 16%, and right 9% UI rails), building top-to-bottom on a tighter 120 ms cascade. Same transparent ADR-0036 stat beat: values roll, land, and hold together before a staggered fade out. Intentional omissions: no collage card, no hard offset shadow, no grit, no backgroundFill — keyed overlay; the footage is the substrate and the mono thread rides the JetBrains Mono values (#fabf47 accent) and captions.",
	"pack": "syntax",
	"kind": "deliverable",
	"state": {
		"transport": {
			"orientation": "vertical",
			"durationSeconds": 6,
			"fps": 30,
			"format": "webm"
		},
		"typography": {
			"fontFamily": "sans",
			"paperColor": "#0a0a0a",
			"inkColor": "#ffffff"
		},
		"marks": {
			"defaults": {},
			"timings": []
		},
		"surface": {
			"type": "plain",
			"content": {
				"body": ""
			},
			"enter": { "start": 0, "duration": 0.05, "ease": "settled" },
			"exit": { "start": 0.88, "duration": 0.04, "ease": "smooth" },
			"diagram": [
				{
					"type": "label",
					"id": "l-headline",
					"position": { "x": 0.48, "y": 0.24 },
					"text": "JAVASCRIPT BY THE NUMBERS",
					"scale": 1.7,
					"enter": { "start": 0.07, "duration": 0.05, "ease": "settled" },
					"exit": { "start": 0.87, "duration": 0.04, "ease": "smooth" },
					"animation": {
						"cascade": { "anchor": "surface", "event": "end", "offsetMs": 120 }
					}
				},
				{
					"type": "stat-callout",
					"id": "s-npm",
					"position": { "x": 0.48, "y": 0.4 },
					"from": 0,
					"to": 2100000000,
					"format": "integer",
					"label": "NPM DOWNLOADS / WEEK",
					"scale": 1,
					"rollStart": 0.14,
					"rollWindow": 0.25,
					"enter": { "start": 0.14, "duration": 0.05, "ease": "settled" },
					"exit": { "start": 0.85, "duration": 0.04, "ease": "smooth" },
					"animation": {
						"cascade": { "anchor": { "block": "l-headline" }, "event": "end", "offsetMs": 120 }
					}
				},
				{
					"type": "stat-callout",
					"id": "s-sites",
					"position": { "x": 0.48, "y": 0.55 },
					"from": 0,
					"to": 97,
					"format": "percent",
					"label": "OF SITES RUN JS",
					"scale": 1,
					"rollStart": 0.21,
					"rollWindow": 0.23,
					"enter": { "start": 0.21, "duration": 0.05, "ease": "settled" },
					"exit": { "start": 0.86, "duration": 0.04, "ease": "smooth" },
					"animation": {
						"cascade": { "anchor": { "block": "s-npm" }, "event": "end", "offsetMs": 120 }
					}
				},
				{
					"type": "stat-callout",
					"id": "s-devs",
					"position": { "x": 0.48, "y": 0.7 },
					"from": 0,
					"to": 11000000,
					"format": "integer",
					"label": "JS DEVELOPERS",
					"scale": 1,
					"rollStart": 0.28,
					"rollWindow": 0.25,
					"enter": { "start": 0.28, "duration": 0.05, "ease": "settled" },
					"exit": { "start": 0.87, "duration": 0.04, "ease": "smooth" },
					"animation": {
						"cascade": { "anchor": { "block": "s-sites" }, "event": "end", "offsetMs": 120 }
					}
				}
			]
		},
		"textAnimations": [],
		"overlays": [],
		"effects": [],
		"audioCues": []
	}
}
