{
	"schema": "hiviz@1",
	"name": "Attention default",
	"description": "Single highlight on the central claim of the Transformer paper.",
	"pack": "syntax",
	"state": {
		"transport": {
			"orientation": "horizontal",
			"durationSeconds": 8,
			"fps": 30,
			"format": "webm"
		},
		"typography": {
			"fontFamily": "serif",
			"paperColor": "#fafaf7",
			"inkColor": "#1a1a1a"
		},
		"marks": {
			"defaults": {
				"highlight": {
					"color": "#fabf47",
					"intensity": 0.62
				},
				"underline": {
					"color": "#00fff5",
					"intensity": 0.62
				},
				"strike": {
					"color": "#de263a",
					"intensity": 0.62
				},
				"circle": {
					"color": "#de263a",
					"intensity": 0.62
				}
			},
			"timings": [
				{
					"start": 0.16,
					"duration": 0.06,
					"ease": "smooth"
				}
			],
			"soundKit": "desk"
		},
		"surface": {
			"type": "paper",
			"content": {
				"title": "Attention Is All You Need",
				"sourceUrl": "https://arxiv.org/abs/1706.03762",
				"author": "Vaswani et al.",
				"affiliation": "Google Brain",
				"bodyLabel": "Abstract",
				"body": "The dominant sequence transduction models are based on complex recurrent or convolutional neural networks in an encoder–decoder configuration. The best-performing models also connect the encoder and decoder through an attention mechanism.\n\nWe propose a new, simpler architecture — the Transformer, based solely on attention mechanisms, dispensing with recurrence and convolutions entirely.\n\nExperiments on two machine translation tasks show these models to be superior in quality while being more parallelizable and [highlight]requiring significantly less time to train[/highlight]. On WMT 2014 English-to-German translation, our model establishes a new state of the art."
			},
			"enter": {
				"start": 0,
				"duration": 0.045,
				"ease": "settled"
			},
			"exit": {
				"start": 0.93,
				"duration": 0.034,
				"ease": "smooth"
			},
			"soundKit": "desk"
		},
		"overlays": [],
		"effects": [
			{
				"type": "paper-grain",
				"id": "frame-grit",
				"params": {
					"warmth": 0.08,
					"density": 0.24
				}
			}
		]
	}
}
